{
  "schema_version": "0.1",
  "type": "APPROVAL_SCOPE",
  "id": "AS-DEMO-001",
  "mission_id": "M-DEMO-001",
  "approval_request_id": "AR-DEMO-001",
  "tool_request_id": "TR-DEMO-002",
  "decision_packet_id": "DP-DEMO-001",
  "granted_by": "COMMANDER",
  "granted_to": "S3",
  "classification": "internal",
  "decision": "approve_once",
  "scope": {
    "action": "deploy_production",
    "tool": "deploy",
    "target": "prod.command-post-dashboard",
    "task_order": "T-DEMO-001",
    "max_executions": 1,
    "valid_from": "2026-06-18T16:30:00+09:00",
    "expires_at": "2026-06-18T17:00:00+09:00"
  },
  "conditions": [
    "Use the exact deployment target only.",
    "Run dry-run before execution.",
    "Stop if rollback artifact is missing."
  ],
  "rollback": [
    "Restore previous deployment artifact.",
    "Verify dashboard state after rollback."
  ],
  "evidence_required": [
    "Approval event.",
    "Dry-run output.",
    "Execution log.",
    "Post-action verification."
  ],
  "release_review_required": false,
  "status": "active",
  "created_at": "2026-06-18T16:30:00+09:00"
}
